2.002841 IP 10.1.3.2.49153 > 10.1.2.3.9: Flags [S], seq 0, win 65535, options [TS val 2000 ecr 0,wscale 2,eol], length 0
2.006823 IP 10.1.3.3.49153 > 10.1.2.3.9: Flags [S], seq 0, win 65535, options [TS val 2000 ecr 0,wscale 2,eol], length 0
2.007702 IP 10.1.3.1.49153 > 10.1.2.4.9: Flags [S], seq 0, win 65535, options [TS val 2000 ecr 0,wscale 2,eol], length 0
2.019461 IP 10.1.2.3.9 > 10.1.3.2.49153: Flags [S.], seq 0, ack 1, win 65535, options [TS val 2009 ecr 2000,wscale 2,eol], length 0
2.019753 IP 10.1.3.2.49153 > 10.1.2.3.9: Flags [.], ack 1, win 32768, options [TS val 2019 ecr 2009,eol], length 0
2.020775 IP 10.1.3.2.49153 > 10.1.2.3.9: Flags [.], seq 1:537, ack 1, win 32768, options [TS val 2019 ecr 2009,eol], length 536
2.028276 IP 10.1.2.3.9 > 10.1.3.3.49153: Flags [S.], seq 0, ack 1, win 65535, options [TS val 2012 ecr 2000,wscale 2,eol], length 0
2.028532 IP 10.1.3.3.49153 > 10.1.2.3.9: Flags [.], ack 1, win 32768, options [TS val 2028 ecr 2012,eol], length 0
2.029608 IP 10.1.3.3.49153 > 10.1.2.3.9: Flags [.], seq 1:537, ack 1, win 32768, options [TS val 2028 ecr 2012,eol], length 536
2.038470 IP 10.1.2.4.9 > 10.1.3.1.49153: Flags [S.], seq 0, ack 1, win 65535, options [TS val 2022 ecr 2000,wscale 2,eol], length 0
2.038591 IP 10.1.3.1.49153 > 10.1.2.4.9: Flags [.], ack 1, win 32768, options [TS val 2038 ecr 2022,eol], length 0
2.038874 IP 10.1.3.1.49153 > 10.1.2.4.9: Flags [.], seq 1:537, ack 1, win 32768, options [TS val 2038 ecr 2022,eol], length 536
2.041292 IP 10.1.2.3.9 > 10.1.3.2.49153: Flags [.], ack 537, win 32768, options [TS val 2035 ecr 2019,eol], length 0
2.042278 IP 10.1.3.2.49153 > 10.1.2.3.9: Flags [.], seq 537:1073, ack 1, win 32768, options [TS val 2041 ecr 2035,eol], length 536
2.043282 IP 10.1.3.2.49153 > 10.1.2.3.9: Flags [.], seq 1073:1609, ack 1, win 32768, options [TS val 2041 ecr 2035,eol], length 536
2.051596 IP 10.1.2.3.9 > 10.1.3.3.49153: Flags [.], ack 537, win 32768, options [TS val 2045 ecr 2028,eol], length 0
2.052654 IP 10.1.3.3.49153 > 10.1.2.3.9: Flags [.], seq 537:1073, ack 1, win 32768, options [TS val 2051 ecr 2045,eol], length 536
2.053712 IP 10.1.3.3.49153 > 10.1.2.3.9: Flags [.], seq 1073:1609, ack 1, win 32768, options [TS val 2051 ecr 2045,eol], length 536
2.080780 IP 10.1.2.3.9 > 10.1.3.2.49153: Flags [.], ack 1609, win 32768, options [TS val 2074 ecr 2041,eol], length 0
2.081820 IP 10.1.3.2.49153 > 10.1.2.3.9: Flags [.], seq 1609:2145, ack 1, win 32768, options [TS val 2080 ecr 2074,eol], length 536
2.082788 IP 10.1.3.2.49153 > 10.1.2.3.9: Flags [.], seq 2145:2681, ack 1, win 32768, options [TS val 2080 ecr 2074,eol], length 536
2.083516 IP 10.1.3.2.49153 > 10.1.2.3.9: Flags [.], seq 2681:3217, ack 1, win 32768, options [TS val 2080 ecr 2074,eol], length 536
2.118540 IP 10.1.2.3.9 > 10.1.3.2.49153: Flags [.], ack 2681, win 32768, options [TS val 2112 ecr 2080,eol], length 0
2.119214 IP 10.1.3.2.49153 > 10.1.2.3.9: Flags [.], seq 3217:3753, ack 1, win 32768, options [TS val 2118 ecr 2112,eol], length 536
2.119915 IP 10.1.3.2.49153 > 10.1.2.3.9: Flags [.], seq 3753:4289, ack 1, win 32768, options [TS val 2118 ecr 2112,eol], length 536
2.120724 IP 10.1.3.2.49153 > 10.1.2.3.9: Flags [.], seq 4289:4825, ack 1, win 32768, options [TS val 2118 ecr 2112,eol], length 536
2.139730 IP 10.1.2.3.9 > 10.1.3.2.49153: Flags [.], ack 3753, win 32768, options [TS val 2133 ecr 2080,eol], length 0
2.140413 IP 10.1.3.2.49153 > 10.1.2.3.9: Flags [.], seq 4825:5361, ack 1, win 32768, options [TS val 2139 ecr 2133,eol], length 536
2.141195 IP 10.1.3.2.49153 > 10.1.2.3.9: Flags [.], seq 5361:5897, ack 1, win 32768, options [TS val 2139 ecr 2133,eol], length 536
2.141887 IP 10.1.3.2.49153 > 10.1.2.3.9: Flags [.], seq 5897:6433, ack 1, win 32768, options [TS val 2139 ecr 2133,eol], length 536
2.186930 IP 10.1.2.3.9 > 10.1.3.2.49153: Flags [.], ack 4289, win 32768, options [TS val 2180 ecr 2118,eol], length 0
2.187649 IP 10.1.3.2.49153 > 10.1.2.3.9: Flags [.], seq 6433:6969, ack 1, win 32768, options [TS val 2186 ecr 2180,eol], length 536
2.188332 IP 10.1.3.2.49153 > 10.1.2.3.9: Flags [.], seq 6969:7505, ack 1, win 32768, options [TS val 2186 ecr 2180,eol], length 536
2.208165 IP 10.1.2.3.9 > 10.1.3.2.49153: Flags [.], ack 4289, win 32768, options [TS val 2202 ecr 2118,eol], length 0
2.208929 IP 10.1.3.2.49153 > 10.1.2.3.9: Flags [.], seq 7505:8041, ack 1, win 32768, options [TS val 2208 ecr 2202,eol], length 536
2.229445 IP 10.1.2.3.9 > 10.1.3.2.49153: Flags [.], ack 4289, win 32768, options [TS val 2223 ecr 2118,eol], length 0
2.230079 IP 10.1.3.2.49153 > 10.1.2.3.9: Flags [.], seq 8041:8577, ack 1, win 32768, options [TS val 2229 ecr 2223,eol], length 536
2.290219 IP 10.1.2.3.9 > 10.1.3.3.49153: Flags [.], ack 1073, win 32768, options [TS val 2284 ecr 2051,eol], length 0
2.291286 IP 10.1.3.3.49153 > 10.1.2.3.9: Flags [.], seq 1609:2145, ack 1, win 32768, options [TS val 2290 ecr 2284,eol], length 536
2.292299 IP 10.1.3.3.49153 > 10.1.2.3.9: Flags [.], seq 2145:2681, ack 1, win 32768, options [TS val 2290 ecr 2284,eol], length 536
2.311802 IP 10.1.2.3.9 > 10.1.3.3.49153: Flags [.], ack 1073, win 32768, options [TS val 2305 ecr 2051,eol], length 0
2.312566 IP 10.1.3.3.49153 > 10.1.2.3.9: Flags [.], seq 2681:3217, ack 1, win 32768, options [TS val 2311 ecr 2305,eol], length 536
2.333082 IP 10.1.2.3.9 > 10.1.3.3.49153: Flags [.], ack 1073, win 32768, options [TS val 2327 ecr 2051,eol], length 0
2.333801 IP 10.1.3.3.49153 > 10.1.2.3.9: Flags [.], seq 3217:3753, ack 1, win 32768, options [TS val 2333 ecr 2327,eol], length 536
2.354318 IP 10.1.2.3.9 > 10.1.3.3.49153: Flags [.], ack 1073, win 32768, options [TS val 2348 ecr 2051,eol], length 0
2.355055 IP 10.1.3.3.49153 > 10.1.2.3.9: Flags [.], seq 1073:1609, ack 1, win 32768, options [TS val 2354 ecr 2348,eol], length 536
3.038470 IP 10.1.3.1.49153 > 10.1.2.4.9: Flags [.], seq 1:537, ack 1, win 32768, options [TS val 3038 ecr 2022,eol], length 536
3.059843 IP 10.1.2.4.9 > 10.1.3.1.49153: Flags [.], ack 537, win 32768, options [TS val 3053 ecr 3038,eol], length 0
3.060027 IP 10.1.3.1.49153 > 10.1.2.4.9: Flags [.], seq 537:1073, ack 1, win 32768, options [TS val 3059 ecr 3053,eol], length 536
3.061013 IP 10.1.3.1.49153 > 10.1.2.4.9: Flags [.], seq 1073:1609, ack 1, win 32768, options [TS val 3059 ecr 3053,eol], length 536
3.090839 IP 10.1.2.4.9 > 10.1.3.1.49153: Flags [.], ack 1609, win 32768, options [TS val 3084 ecr 3059,eol], length 0
3.090978 IP 10.1.3.1.49153 > 10.1.2.4.9: Flags [.], seq 1609:2145, ack 1, win 32768, options [TS val 3090 ecr 3084,eol], length 536
3.091964 IP 10.1.3.1.49153 > 10.1.2.4.9: Flags [.], seq 2145:2681, ack 1, win 32768, options [TS val 3090 ecr 3084,eol], length 536
3.187370 IP 10.1.3.2.49153 > 10.1.2.3.9: Flags [.], seq 4289:4825, ack 1, win 32768, options [TS val 3186 ecr 2223,eol], length 536
3.290799 IP 10.1.3.3.49153 > 10.1.2.3.9: Flags [.], seq 1073:1609, ack 1, win 32768, options [TS val 3290 ecr 2348,eol], length 536
3.312349 IP 10.1.2.4.9 > 10.1.3.1.49153: Flags [.], ack 2145, win 32768, options [TS val 3306 ecr 3090,eol], length 0
3.312533 IP 10.1.3.1.49153 > 10.1.2.4.9: Flags [.], seq 2681:3217, ack 1, win 32768, options [TS val 3312 ecr 3306,eol], length 536
4.312349 IP 10.1.3.1.49153 > 10.1.2.4.9: Flags [.], seq 2145:2681, ack 1, win 32768, options [TS val 4312 ecr 3306,eol], length 536
5.187370 IP 10.1.3.2.49153 > 10.1.2.3.9: Flags [.], seq 4289:4825, ack 1, win 32768, options [TS val 5186 ecr 2223,eol], length 536
5.290799 IP 10.1.3.3.49153 > 10.1.2.3.9: Flags [.], seq 1073:1609, ack 1, win 32768, options [TS val 5290 ecr 2348,eol], length 536
5.311315 IP 10.1.2.3.9 > 10.1.3.3.49153: Flags [.], ack 2145, win 32768, options [TS val 5305 ecr 5290,eol], length 0
5.312052 IP 10.1.3.3.49153 > 10.1.2.3.9: Flags [.], seq 2145:2681, ack 1, win 32768, options [TS val 5311 ecr 5305,eol], length 536
5.312735 IP 10.1.3.3.49153 > 10.1.2.3.9: Flags [.], seq 2681:3217, ack 1, win 32768, options [TS val 5311 ecr 5305,eol], length 536
5.342008 IP 10.1.2.3.9 > 10.1.3.3.49153: Flags [.], ack 2145, win 32768, options [TS val 5335 ecr 5290,eol], length 0
6.311895 IP 10.1.3.3.49153 > 10.1.2.3.9: Flags [.], seq 2145:2681, ack 1, win 32768, options [TS val 6311 ecr 5335,eol], length 536
6.312349 IP 10.1.3.1.49153 > 10.1.2.4.9: Flags [.], seq 2145:2681, ack 1, win 32768, options [TS val 6312 ecr 3306,eol], length 536
6.541850 IP 10.1.2.4.9 > 10.1.3.1.49153: Flags [.], ack 2681, win 32768, options [TS val 6535 ecr 6312,eol], length 0
6.542025 IP 10.1.3.1.49153 > 10.1.2.4.9: Flags [.], seq 2681:3217, ack 1, win 32768, options [TS val 6541 ecr 6535,eol], length 536
6.542708 IP 10.1.3.1.49153 > 10.1.2.4.9: Flags [.], seq 3217:3753, ack 1, win 32768, options [TS val 6541 ecr 6535,eol], length 536
7.541850 IP 10.1.3.1.49153 > 10.1.2.4.9: Flags [.], seq 2681:3217, ack 1, win 32768, options [TS val 7541 ecr 6535,eol], length 536
7.762946 IP 10.1.2.4.9 > 10.1.3.1.49153: Flags [.], ack 3217, win 32768, options [TS val 7756 ecr 7541,eol], length 0
7.763094 IP 10.1.3.1.49153 > 10.1.2.4.9: Flags [.], seq 3217:3753, ack 1, win 32768, options [TS val 7762 ecr 7756,eol], length 536
7.763786 IP 10.1.3.1.49153 > 10.1.2.4.9: Flags [.], seq 3753:4289, ack 1, win 32768, options [TS val 7762 ecr 7756,eol], length 536
7.793630 IP 10.1.2.4.9 > 10.1.3.1.49153: Flags [.], ack 4289, win 32768, options [TS val 7787 ecr 7762,eol], length 0
7.793823 IP 10.1.3.1.49153 > 10.1.2.4.9: Flags [.], seq 4289:4825, ack 1, win 32768, options [TS val 7793 ecr 7787,eol], length 536
7.794587 IP 10.1.3.1.49153 > 10.1.2.4.9: Flags [.], seq 4825:5361, ack 1, win 32768, options [TS val 7793 ecr 7787,eol], length 536
8.311895 IP 10.1.3.3.49153 > 10.1.2.3.9: Flags [.], seq 2145:2681, ack 1, win 32768, options [TS val 8311 ecr 5335,eol], length 536
8.332371 IP 10.1.2.3.9 > 10.1.3.3.49153: Flags [.], ack 3753, win 32768, options [TS val 8326 ecr 8311,eol], length 0
8.333180 IP 10.1.3.3.49153 > 10.1.2.3.9: Flags [.], seq 3753:4289, ack 1, win 32768, options [TS val 8332 ecr 8326,eol], length 536
8.333723 IP 10.1.3.3.49153 > 10.1.2.3.9: Flags [.], seq 4289:4825, ack 1, win 32768, options [TS val 8332 ecr 8326,eol], length 536
8.363097 IP 10.1.2.3.9 > 10.1.3.3.49153: Flags [.], ack 3753, win 32768, options [TS val 8357 ecr 8311,eol], length 0
8.793630 IP 10.1.3.1.49153 > 10.1.2.4.9: Flags [.], seq 4289:4825, ack 1, win 32768, options [TS val 8793 ecr 7787,eol], length 536
9.187370 IP 10.1.3.2.49153 > 10.1.2.3.9: Flags [.], seq 4289:4825, ack 1, win 32768, options [TS val 9186 ecr 2223,eol], length 536
9.332811 IP 10.1.3.3.49153 > 10.1.2.3.9: Flags [.], seq 3753:4289, ack 1, win 32768, options [TS val 9332 ecr 8357,eol], length 536
9.353288 IP 10.1.2.3.9 > 10.1.3.3.49153: Flags [.], ack 4825, win 32768, options [TS val 9347 ecr 9332,eol], length 0
9.353867 IP 10.1.3.3.49153 > 10.1.2.3.9: Flags [.], seq 4825:5361, ack 1, win 32768, options [TS val 9353 ecr 9347,eol], length 536
9.354452 IP 10.1.3.3.49153 > 10.1.2.3.9: Flags [.], seq 5361:5897, ack 1, win 32768, options [TS val 9353 ecr 9347,eol], length 536
9.355046 IP 10.1.3.3.49153 > 10.1.2.3.9: Flags [.], seq 5897:6433, ack 1, win 32768, options [TS val 9353 ecr 9347,eol], length 536
